packages/trifast/trifast-0.1.8.tar.gz/trifast-0.1.8/src/trifast/configs/_bwd_kv_NVIDIA-GeForce-RTX-3090_8-6.json
{
    "1_16_32_torch.float32_torch.float32_torch.float32_torch.float32_torch.float32_torch.float32_torch.bool_torch.float32_torch.float32_torch.float32": {
        "kwargs": {
            "BLOCK_J": 32,
            "BLOCK_K": 16
        },
        "num_warps": 2,
        "num_stages": 1,
        "num_ctas": 1,
        "maxnreg": null
    },
    "1_32_32_torch.float32_torch.float32_torch.float32_torch.float32_torch.float32_torch.float32_torch.bool_torch.float32_torch.float32_torch.float32": {
        "kwargs": {
            "BLOCK_J": 32,
            "BLOCK_K": 16
        },
        "num_warps": 2,
        "num_stages": 1,
        "num_ctas": 1,
        "maxnreg": null
    },
    "1_64_32_torch.float32_torch.float32_torch.float32_torch.float32_torch.float32_torch.float32_torch.bool_torch.float32_torch.float32_torch.float32": {
        "kwargs": {
            "BLOCK_J": 32,
            "BLOCK_K": 16
        },
        "num_warps": 2,
        "num_stages": 2,
        "num_ctas": 1,
        "maxnreg": null
    },
    "4_16_32_torch.float32_torch.float32_torch.float32_torch.float32_torch.float32_torch.float32_torch.bool_torch.float32_torch.float32_torch.float32": {
        "kwargs": {
            "BLOCK_J": 32,
            "BLOCK_K": 16
        },
        "num_warps": 1,
        "num_stages": 1,
        "num_ctas": 1,
        "maxnreg": null
    },
    "4_32_32_torch.float32_torch.float32_torch.float32_torch.float32_torch.float32_torch.float32_torch.bool_torch.float32_torch.float32_torch.float32": {
        "kwargs": {
            "BLOCK_J": 32,
            "BLOCK_K": 16
        },
        "num_warps": 1,
        "num_stages": 2,
        "num_ctas": 1,
        "maxnreg": null
    },
    "4_64_32_torch.float32_torch.float32_torch.float32_torch.float32_torch.float32_torch.float32_torch.bool_torch.float32_torch.float32_torch.float32": {
        "kwargs": {
            "BLOCK_J": 32,
            "BLOCK_K": 16
        },
        "num_warps": 2,
        "num_stages": 2,
        "num_ctas": 1,
        "maxnreg": null
    },
    "1_16_32_torch.bfloat16_torch.bfloat16_torch.bfloat16_torch.bfloat16_torch.bfloat16_torch.float32_torch.bool_torch.bfloat16_torch.bfloat16_torch.bfloat16": {
        "kwargs": {
            "BLOCK_J": 32,
            "BLOCK_K": 16
        },
        "num_warps": 2,
        "num_stages": 3,
        "num_ctas": 1,
        "maxnreg": null
    },
    "1_32_32_torch.bfloat16_torch.bfloat16_torch.bfloat16_torch.bfloat16_torch.bfloat16_torch.float32_torch.bool_torch.bfloat16_torch.bfloat16_torch.bfloat16": {
        "kwargs": {
            "BLOCK_J": 32,
            "BLOCK_K": 16
        },
        "num_warps": 4,
        "num_stages": 2,
        "num_ctas": 1,
        "maxnreg": null
    },
    "1_64_32_torch.bfloat16_torch.bfloat16_torch.bfloat16_torch.bfloat16_torch.bfloat16_torch.float32_torch.bool_torch.bfloat16_torch.bfloat16_torch.bfloat16": {
        "kwargs": {
            "BLOCK_J": 32,
            "BLOCK_K": 16
        },
        "num_warps": 2,
        "num_stages": 1,
        "num_ctas": 1,
        "maxnreg": null
    },
    "4_16_32_torch.bfloat16_torch.bfloat16_torch.bfloat16_torch.bfloat16_torch.bfloat16_torch.float32_torch.bool_torch.bfloat16_torch.bfloat16_torch.bfloat16": {
        "kwargs": {
            "BLOCK_J": 32,
            "BLOCK_K": 16
        },
        "num_warps": 1,
        "num_stages": 6,
        "num_ctas": 1,
        "maxnreg": null
    },
    "4_32_32_torch.bfloat16_torch.bfloat16_torch.bfloat16_torch.bfloat16_torch.bfloat16_torch.float32_torch.bool_torch.bfloat16_torch.bfloat16_torch.bfloat16": {
        "kwargs": {
            "BLOCK_J": 32,
            "BLOCK_K": 32
        },
        "num_warps": 2,
        "num_stages": 3,
        "num_ctas": 1,
        "maxnreg": null
    },
    "4_64_32_torch.bfloat16_torch.bfloat16_torch.bfloat16_torch.bfloat16_torch.bfloat16_torch.float32_torch.bool_torch.bfloat16_torch.bfloat16_torch.bfloat16": {
        "kwargs": {
            "BLOCK_J": 16,
            "BLOCK_K": 16
        },
        "num_warps": 2,
        "num_stages": 1,
        "num_ctas": 1,
        "maxnreg": null
    },
    "1_16_64_torch.float32_torch.float32_torch.float32_torch.float32_torch.float32_torch.float32_torch.bool_torch.float32_torch.float32_torch.float32": {
        "kwargs": {
            "BLOCK_J": 32,
            "BLOCK_K": 16
        },
        "num_warps": 1,
        "num_stages": 1,
        "num_ctas": 1,
        "maxnreg": null
    },
    "1_32_64_torch.float32_torch.float32_torch.float32_torch.float32_torch.float32_torch.float32_torch.bool_torch.float32_torch.float32_torch.float32": {
        "kwargs": {
            "BLOCK_J": 32,
            "BLOCK_K": 16
        },
        "num_warps": 1,
        "num_stages": 2,
        "num_ctas": 1,
        "maxnreg": null
    },
    "1_64_64_torch.float32_torch.float32_torch.float32_torch.float32_torch.float32_torch.float32_torch.bool_torch.float32_torch.float32_torch.float32": {
        "kwargs": {
            "BLOCK_J": 32,
            "BLOCK_K": 16
        },
        "num_warps": 2,
        "num_stages": 2,
        "num_ctas": 1,
        "maxnreg": null
    },
    "4_16_64_torch.float32_torch.float32_torch.float32_torch.float32_torch.float32_torch.float32_torch.bool_torch.float32_torch.float32_torch.float32": {
        "kwargs": {
            "BLOCK_J": 32,
            "BLOCK_K": 32
        },
        "num_warps": 1,
        "num_stages": 1,
        "num_ctas": 1,
        "maxnreg": null
    },
    "4_32_64_torch.float32_torch.float32_torch.float32_torch.float32_torch.float32_torch.float32_torch.bool_torch.float32_torch.float32_torch.float32": {
        "kwargs": {
            "BLOCK_J": 64,
            "BLOCK_K": 16
        },
        "num_warps": 2,
        "num_stages": 1,
        "num_ctas": 1,
        "maxnreg": null
    },
    "4_64_64_torch.float32_torch.float32_torch.float32_torch.float32_torch.float32_torch.float32_torch.bool_torch.float32_torch.float32_torch.float32": {
        "kwargs": {
            "BLOCK_J": 32,
            "BLOCK_K": 16
        },
        "num_warps": 2,
        "num_stages": 2,
        "num_ctas": 1,
        "maxnreg": null
    },
    "1_16_64_torch.bfloat16_torch.bfloat16_torch.bfloat16_torch.bfloat16_torch.bfloat16_torch.float32_torch.bool_torch.bfloat16_torch.bfloat16_torch.bfloat16": {
        "kwargs": {
            "BLOCK_J": 64,
            "BLOCK_K": 16
        },
        "num_warps": 2,
        "num_stages": 1,
        "num_ctas": 1,
        "maxnreg": null
    },
    "1_32_64_torch.bfloat16_torch.bfloat16_torch.bfloat16_torch.bfloat16_torch.bfloat16_torch.float32_torch.bool_torch.bfloat16_torch.bfloat16_torch.bfloat16": {
        "kwargs": {
            "BLOCK_J": 64,
            "BLOCK_K": 32
        },
        "num_warps": 2,
        "num_stages": 1,
        "num_ctas": 1,
        "maxnreg": null
    },
    "1_64_64_torch.bfloat16_torch.bfloat16_torch.bfloat16_torch.bfloat16_torch.bfloat16_torch.float32_torch.bool_torch.bfloat16_torch.bfloat16_torch.bfloat16": {
        "kwargs": {
            "BLOCK_J": 32,
            "BLOCK_K": 16
        },
        "num_warps": 2,
        "num_stages": 1,
        "num_ctas": 1,
        "maxnreg": null
    },
    "4_16_64_torch.bfloat16_torch.bfloat16_torch.bfloat16_torch.bfloat16_torch.bfloat16_torch.float32_torch.bool_torch.bfloat16_torch.bfloat16_torch.bfloat16": {
        "kwargs": {
            "BLOCK_J": 32,
            "BLOCK_K": 64
        },
        "num_warps": 2,
        "num_stages": 1,
        "num_ctas": 1,
        "maxnreg": null
    },
    "4_32_64_torch.bfloat16_torch.bfloat16_torch.bfloat16_torch.bfloat16_torch.bfloat16_torch.float32_torch.bool_torch.bfloat16_torch.bfloat16_torch.bfloat16": {
        "kwargs": {
            "BLOCK_J": 32,
            "BLOCK_K": 32
        },
        "num_warps": 1,
        "num_stages": 2,
        "num_ctas": 1,
        "maxnreg": null
    },
    "4_64_64_torch.bfloat16_torch.bfloat16_torch.bfloat16_torch.bfloat16_torch.bfloat16_torch.float32_torch.bool_torch.bfloat16_torch.bfloat16_torch.bfloat16": {
        "kwargs": {
            "BLOCK_J": 64,
            "BLOCK_K": 32
        },
        "num_warps": 2,
        "num_stages": 1,
        "num_ctas": 1,
        "maxnreg": null
    },
    "1_16_128_torch.float32_torch.float32_torch.float32_torch.float32_torch.float32_torch.float32_torch.bool_torch.float32_torch.float32_torch.float32": {
        "kwargs": {
            "BLOCK_J": 32,
            "BLOCK_K": 32
        },
        "num_warps": 1,
        "num_stages": 1,
        "num_ctas": 1,
        "maxnreg": null
    },
    "1_32_128_torch.float32_torch.float32_torch.float32_torch.float32_torch.float32_torch.float32_torch.bool_torch.float32_torch.float32_torch.float32": {
        "kwargs": {
            "BLOCK_J": 32,
            "BLOCK_K": 16
        },
        "num_warps": 1,
        "num_stages": 1,
        "num_ctas": 1,
        "maxnreg": null
    },
    "1_64_128_torch.float32_torch.float32_torch.float32_torch.float32_torch.float32_torch.float32_torch.bool_torch.float32_torch.float32_torch.float32": {
        "kwargs": {
            "BLOCK_J": 32,
            "BLOCK_K": 16
        },
        "num_warps": 2,
        "num_stages": 2,
        "num_ctas": 1,
        "maxnreg": null
    },
    "4_16_128_torch.float32_torch.float32_torch.float32_torch.float32_torch.float32_torch.float32_torch.bool_torch.float32_torch.float32_torch.float32": {
        "kwargs": {
            "BLOCK_J": 32,
            "BLOCK_K": 32
        },
        "num_warps": 1,
        "num_stages": 1,
        "num_ctas": 1,
        "maxnreg": null
    },
    "4_32_128_torch.float32_torch.float32_torch.float32_torch.float32_torch.float32_torch.float32_torch.bool_torch.float32_torch.float32_torch.float32": {
        "kwargs": {
            "BLOCK_J": 16,
            "BLOCK_K": 64
        },
        "num_warps": 2,
        "num_stages": 2,
        "num_ctas": 1,
        "maxnreg": null
    },
    "4_64_128_torch.float32_torch.float32_torch.float32_torch.float32_torch.float32_torch.float32_torch.bool_torch.float32_torch.float32_torch.float32": {
        "kwargs": {
            "BLOCK_J": 32,
            "BLOCK_K": 16
        },
        "num_warps": 2,
        "num_stages": 2,
        "num_ctas": 1,
        "maxnreg": null
    },
    "1_16_128_torch.bfloat16_torch.bfloat16_torch.bfloat16_torch.bfloat16_torch.bfloat16_torch.float32_torch.bool_torch.bfloat16_torch.bfloat16_torch.bfloat16": {
        "kwargs": {
            "BLOCK_J": 32,
            "BLOCK_K": 32
        },
        "num_warps": 1,
        "num_stages": 1,
        "num_ctas": 1,
        "maxnreg": null
    },
    "1_32_128_torch.bfloat16_torch.bfloat16_torch.bfloat16_torch.bfloat16_torch.bfloat16_torch.float32_torch.bool_torch.bfloat16_torch.bfloat16_torch.bfloat16": {
        "kwargs": {
            "BLOCK_J": 32,
            "BLOCK_K": 32
        },
        "num_warps": 1,
        "num_stages": 2,
        "num_ctas": 1,
        "maxnreg": null
    },
    "1_64_128_torch.bfloat16_torch.bfloat16_torch.bfloat16_torch.bfloat16_torch.bfloat16_torch.float32_torch.bool_torch.bfloat16_torch.bfloat16_torch.bfloat16": {
        "kwargs": {
            "BLOCK_J": 64,
            "BLOCK_K": 16
        },
        "num_warps": 2,
        "num_stages": 2,
        "num_ctas": 1,
        "maxnreg": null
    },
    "4_16_128_torch.bfloat16_torch.bfloat16_torch.bfloat16_torch.bfloat16_torch.bfloat16_torch.float32_torch.bool_torch.bfloat16_torch.bfloat16_torch.bfloat16": {
        "kwargs": {
            "BLOCK_J": 32,
            "BLOCK_K": 32
        },
        "num_warps": 1,
        "num_stages": 3,
        "num_ctas": 1,
        "maxnreg": null
    },
    "4_32_128_torch.bfloat16_torch.bfloat16_torch.bfloat16_torch.bfloat16_torch.bfloat16_torch.float32_torch.bool_torch.bfloat16_torch.bfloat16_torch.bfloat16": {
        "kwargs": {
            "BLOCK_J": 32,
            "BLOCK_K": 32
        },
        "num_warps": 1,
        "num_stages": 2,
        "num_ctas": 1,
        "maxnreg": null
    },
    "4_64_128_torch.bfloat16_torch.bfloat16_torch.bfloat16_torch.bfloat16_torch.bfloat16_torch.float32_torch.bool_torch.bfloat16_torch.bfloat16_torch.bfloat16": {
        "kwargs": {
            "BLOCK_J": 64,
            "BLOCK_K": 16
        },
        "num_warps": 2,
        "num_stages": 2,
        "num_ctas": 1,
        "maxnreg": null
    },
    "1_16_256_torch.float32_torch.float32_torch.float32_torch.float32_torch.float32_torch.float32_torch.bool_torch.float32_torch.float32_torch.float32": {
        "kwargs": {
            "BLOCK_J": 32,
            "BLOCK_K": 32
        },
        "num_warps": 1,
        "num_stages": 1,
        "num_ctas": 1,
        "maxnreg": null
    },
    "1_32_256_torch.float32_torch.float32_torch.float32_torch.float32_torch.float32_torch.float32_torch.bool_torch.float32_torch.float32_torch.float32": {
        "kwargs": {
            "BLOCK_J": 64,
            "BLOCK_K": 16
        },
        "num_warps": 2,
        "num_stages": 1,
        "num_ctas": 1,
        "maxnreg": null
    },
    "1_64_256_torch.float32_torch.float32_torch.float32_torch.float32_torch.float32_torch.float32_torch.bool_torch.float32_torch.float32_torch.float32": {
        "kwargs": {
            "BLOCK_J": 32,
            "BLOCK_K": 16
        },
        "num_warps": 2,
        "num_stages": 2,
        "num_ctas": 1,
        "maxnreg": null
    },
    "4_16_256_torch.float32_torch.float32_torch.float32_torch.float32_torch.float32_torch.float32_torch.bool_torch.float32_torch.float32_torch.float32": {
        "kwargs": {
            "BLOCK_J": 32,
            "BLOCK_K": 64
        },
        "num_warps": 2,
        "num_stages": 2,
        "num_ctas": 1,
        "maxnreg": null
    },
    "4_32_256_torch.float32_torch.float32_torch.float32_torch.float32_torch.float32_torch.float32_torch.bool_torch.float32_torch.float32_torch.float32": {
        "kwargs": {
            "BLOCK_J": 64,
            "BLOCK_K": 16
        },
        "num_warps": 2,
        "num_stages": 1,
        "num_ctas": 1,
        "maxnreg": null
    },
    "4_64_256_torch.float32_torch.float32_torch.float32_torch.float32_torch.float32_torch.float32_torch.bool_torch.float32_torch.float32_torch.float32": {
        "kwargs": {
            "BLOCK_J": 16,
            "BLOCK_K": 32
        },
        "num_warps": 2,
        "num_stages": 2,
        "num_ctas": 1,
        "maxnreg": null
    },
    "1_16_256_torch.bfloat16_torch.bfloat16_torch.bfloat16_torch.bfloat16_torch.bfloat16_torch.float32_torch.bool_torch.bfloat16_torch.bfloat16_torch.bfloat16": {
        "kwargs": {
            "BLOCK_J": 32,
            "BLOCK_K": 32
        },
        "num_warps": 1,
        "num_stages": 2,
        "num_ctas": 1,
        "maxnreg": null
    },
    "1_32_256_torch.bfloat16_torch.bfloat16_torch.bfloat16_torch.bfloat16_torch.bfloat16_torch.float32_torch.bool_torch.bfloat16_torch.bfloat16_torch.bfloat16": {
        "kwargs": {
            "BLOCK_J": 32,
            "BLOCK_K": 32
        },
        "num_warps": 1,
        "num_stages": 2,
        "num_ctas": 1,
        "maxnreg": null
    },
    "1_64_256_torch.bfloat16_torch.bfloat16_torch.bfloat16_torch.bfloat16_torch.bfloat16_torch.float32_torch.bool_torch.bfloat16_torch.bfloat16_torch.bfloat16": {
        "kwargs": {
            "BLOCK_J": 64,
            "BLOCK_K": 32
        },
        "num_warps": 2,
        "num_stages": 1,
        "num_ctas": 1,
        "maxnreg": null
    },
    "4_16_256_torch.bfloat16_torch.bfloat16_torch.bfloat16_torch.bfloat16_torch.bfloat16_torch.float32_torch.bool_torch.bfloat16_torch.bfloat16_torch.bfloat16": {
        "kwargs": {
            "BLOCK_J": 32,
            "BLOCK_K": 32
        },
        "num_warps": 1,
        "num_stages": 3,
        "num_ctas": 1,
        "maxnreg": null
    },
    "4_32_256_torch.bfloat16_torch.bfloat16_torch.bfloat16_torch.bfloat16_torch.bfloat16_torch.float32_torch.bool_torch.bfloat16_torch.bfloat16_torch.bfloat16": {
        "kwargs": {
            "BLOCK_J": 32,
            "BLOCK_K": 32
        },
        "num_warps": 1,
        "num_stages": 2,
        "num_ctas": 1,
        "maxnreg": null
    },
    "4_64_256_torch.bfloat16_torch.bfloat16_torch.bfloat16_torch.bfloat16_torch.bfloat16_torch.float32_torch.bool_torch.bfloat16_torch.bfloat16_torch.bfloat16": {
        "kwargs": {
            "BLOCK_J": 64,
            "BLOCK_K": 32
        },
        "num_warps": 2,
        "num_stages": 1,
        "num_ctas": 1,
        "maxnreg": null
    },
    "1_16_512_torch.float32_torch.float32_torch.float32_torch.float32_torch.float32_torch.float32_torch.bool_torch.float32_torch.float32_torch.float32": {
        "kwargs": {
            "BLOCK_J": 32,
            "BLOCK_K": 32
        },
        "num_warps": 1,
        "num_stages": 1,
        "num_ctas": 1,
        "maxnreg": null
    },
    "1_32_512_torch.float32_torch.float32_torch.float32_torch.float32_torch.float32_torch.float32_torch.bool_torch.float32_torch.float32_torch.float32": {
        "kwargs": {
            "BLOCK_J": 32,
            "BLOCK_K": 16
        },
        "num_warps": 1,
        "num_stages": 1,
        "num_ctas": 1,
        "maxnreg": null
    },
    "1_64_512_torch.float32_torch.float32_torch.float32_torch.float32_torch.float32_torch.float32_torch.bool_torch.float32_torch.float32_torch.float32": {
        "kwargs": {
            "BLOCK_J": 32,
            "BLOCK_K": 16
        },
        "num_warps": 2,
        "num_stages": 2,
        "num_ctas": 1,
        "maxnreg": null
    },
    "4_16_512_torch.float32_torch.float32_torch.float32_torch.float32_torch.float32_torch.float32_torch.bool_torch.float32_torch.float32_torch.float32": {
        "kwargs": {
            "BLOCK_J": 32,
            "BLOCK_K": 64
        },
        "num_warps": 2,
        "num_stages": 2,
        "num_ctas": 1,
        "maxnreg": null
    },
    "4_32_512_torch.float32_torch.float32_torch.float32_torch.float32_torch.float32_torch.float32_torch.bool_torch.float32_torch.float32_torch.float32": {
        "kwargs": {
            "BLOCK_J": 64,
            "BLOCK_K": 16
        },
        "num_warps": 2,
        "num_stages": 1,
        "num_ctas": 1,
        "maxnreg": null
    },
    "4_64_512_torch.float32_torch.float32_torch.float32_torch.float32_torch.float32_torch.float32_torch.bool_torch.float32_torch.float32_torch.float32": {
        "kwargs": {
            "BLOCK_J": 32,
            "BLOCK_K": 16
        },
        "num_warps": 2,
        "num_stages": 2,
        "num_ctas": 1,
        "maxnreg": null
    },
    "1_16_512_torch.bfloat16_torch.bfloat16_torch.bfloat16_torch.bfloat16_torch.bfloat16_torch.float32_torch.bool_torch.bfloat16_torch.bfloat16_torch.bfloat16": {
        "kwargs": {
            "BLOCK_J": 32,
            "BLOCK_K": 32
        },
        "num_warps": 1,
        "num_stages": 2,
        "num_ctas": 1,
        "maxnreg": null
    },
    "1_32_512_torch.bfloat16_torch.bfloat16_torch.bfloat16_torch.bfloat16_torch.bfloat16_torch.float32_torch.bool_torch.bfloat16_torch.bfloat16_torch.bfloat16": {
        "kwargs": {
            "BLOCK_J": 32,
            "BLOCK_K": 32
        },
        "num_warps": 1,
        "num_stages": 2,
        "num_ctas": 1,
        "maxnreg": null
    },
    "1_64_512_torch.bfloat16_torch.bfloat16_torch.bfloat16_torch.bfloat16_torch.bfloat16_torch.float32_torch.bool_torch.bfloat16_torch.bfloat16_torch.bfloat16": {
        "kwargs": {
            "BLOCK_J": 16,
            "BLOCK_K": 32
        },
        "num_warps": 2,
        "num_stages": 1,
        "num_ctas": 1,
        "maxnreg": null
    },
    "4_16_512_torch.bfloat16_torch.bfloat16_torch.bfloat16_torch.bfloat16_torch.bfloat16_torch.float32_torch.bool_torch.bfloat16_torch.bfloat16_torch.bfloat16": {
        "kwargs": {
            "BLOCK_J": 16,
            "BLOCK_K": 64
        },
        "num_warps": 1,
        "num_stages": 1,
        "num_ctas": 1,
        "maxnreg": null
    },
    "4_32_512_torch.bfloat16_torch.bfloat16_torch.bfloat16_torch.bfloat16_torch.bfloat16_torch.float32_torch.bool_torch.bfloat16_torch.bfloat16_torch.bfloat16": {
        "kwargs": {
            "BLOCK_J": 32,
            "BLOCK_K": 32
        },
        "num_warps": 1,
        "num_stages": 2,
        "num_ctas": 1,
        "maxnreg": null
    },
    "4_64_512_torch.bfloat16_torch.bfloat16_torch.bfloat16_torch.bfloat16_torch.bfloat16_torch.float32_torch.bool_torch.bfloat16_torch.bfloat16_torch.bfloat16": {
        "kwargs": {
            "BLOCK_J": 16,
            "BLOCK_K": 32
        },
        "num_warps": 2,
        "num_stages": 1,
        "num_ctas": 1,
        "maxnreg": null
    },
    "1_16_1024_torch.float32_torch.float32_torch.float32_torch.float32_torch.float32_torch.float32_torch.bool_torch.float32_torch.float32_torch.float32": {
        "kwargs": {
            "BLOCK_J": 32,
            "BLOCK_K": 32
        },
        "num_warps": 1,
        "num_stages": 1,
        "num_ctas": 1,
        "maxnreg": null
    },
    "1_32_1024_torch.float32_torch.float32_torch.float32_torch.float32_torch.float32_torch.float32_torch.bool_torch.float32_torch.float32_torch.float32": {
        "kwargs": {
            "BLOCK_J": 64,
            "BLOCK_K": 16
        },
        "num_warps": 2,
        "num_stages": 1,
        "num_ctas": 1,
        "maxnreg": null
    },
    "1_64_1024_torch.float32_torch.float32_torch.float32_torch.float32_torch.float32_torch.float32_torch.bool_torch.float32_torch.float32_torch.float32": {
        "kwargs": {
            "BLOCK_J": 32,
            "BLOCK_K": 16
        },
        "num_warps": 2,
        "num_stages": 2,
        "num_ctas": 1,
        "maxnreg": null
    },
    "4_16_1024_torch.float32_torch.float32_torch.float32_torch.float32_torch.float32_torch.float32_torch.bool_torch.float32_torch.float32_torch.float32": {
        "kwargs": {
            "BLOCK_J": 32,
            "BLOCK_K": 32
        },
        "num_warps": 1,
        "num_stages": 1,
        "num_ctas": 1,
        "maxnreg": null
    },
    "4_32_1024_torch.float32_torch.float32_torch.float32_torch.float32_torch.float32_torch.float32_torch.bool_torch.float32_torch.float32_torch.float32": {
        "kwargs": {
            "BLOCK_J": 16,
            "BLOCK_K": 64
        },
        "num_warps": 2,
        "num_stages": 2,
        "num_ctas": 1,
        "maxnreg": null
    },
    "4_64_1024_torch.float32_torch.float32_torch.float32_torch.float32_torch.float32_torch.float32_torch.bool_torch.float32_torch.float32_torch.float32": {
        "kwargs": {
            "BLOCK_J": 32,
            "BLOCK_K": 16
        },
        "num_warps": 2,
        "num_stages": 2,
        "num_ctas": 1,
        "maxnreg": null
    },
    "1_16_1024_torch.bfloat16_torch.bfloat16_torch.bfloat16_torch.bfloat16_torch.bfloat16_torch.float32_torch.bool_torch.bfloat16_torch.bfloat16_torch.bfloat16": {
        "kwargs": {
            "BLOCK_J": 32,
            "BLOCK_K": 32
        },
        "num_warps": 2,
        "num_stages": 1,
        "num_ctas": 1,
        "maxnreg": null
    },
    "1_32_1024_torch.bfloat16_torch.bfloat16_torch.bfloat16_torch.bfloat16_torch.bfloat16_torch.float32_torch.bool_torch.bfloat16_torch.bfloat16_torch.bfloat16": {
        "kwargs": {
            "BLOCK_J": 32,
            "BLOCK_K": 32
        },
        "num_warps": 1,
        "num_stages": 2,
        "num_ctas": 1,
        "maxnreg": null
    },
    "1_64_1024_torch.bfloat16_torch.bfloat16_torch.bfloat16_torch.bfloat16_torch.bfloat16_torch.float32_torch.bool_torch.bfloat16_torch.bfloat16_torch.bfloat16": {
        "kwargs": {
            "BLOCK_J": 16,
            "BLOCK_K": 32
        },
        "num_warps": 2,
        "num_stages": 1,
        "num_ctas": 1,
        "maxnreg": null
    },
    "4_16_1024_torch.bfloat16_torch.bfloat16_torch.bfloat16_torch.bfloat16_torch.bfloat16_torch.float32_torch.bool_torch.bfloat16_torch.bfloat16_torch.bfloat16": {
        "kwargs": {
            "BLOCK_J": 32,
            "BLOCK_K": 32
        },
        "num_warps": 1,
        "num_stages": 2,
        "num_ctas": 1,
        "maxnreg": null
    },
    "4_32_1024_torch.bfloat16_torch.bfloat16_torch.bfloat16_torch.bfloat16_torch.bfloat16_torch.float32_torch.bool_torch.bfloat16_torch.bfloat16_torch.bfloat16": {
        "kwargs": {
            "BLOCK_J": 32,
            "BLOCK_K": 32
        },
        "num_warps": 1,
        "num_stages": 2,
        "num_ctas": 1,
        "maxnreg": null
    },
    "4_64_1024_torch.bfloat16_torch.bfloat16_torch.bfloat16_torch.bfloat16_torch.bfloat16_torch.float32_torch.bool_torch.bfloat16_torch.bfloat16_torch.bfloat16": {
        "kwargs": {
            "BLOCK_J": 16,
            "BLOCK_K": 32
        },
        "num_warps": 2,
        "num_stages": 2,
        "num_ctas": 1,
        "maxnreg": null
    },
    "1_16_2048_torch.float32_torch.float32_torch.float32_torch.float32_torch.float32_torch.float32_torch.bool_torch.float32_torch.float32_torch.float32": {
        "kwargs": {
            "BLOCK_J": 32,
            "BLOCK_K": 32
        },
        "num_warps": 1,
        "num_stages": 1,
        "num_ctas": 1,
        "maxnreg": null
    },
    "1_32_2048_torch.float32_torch.float32_torch.float32_torch.float32_torch.float32_torch.float32_torch.bool_torch.float32_torch.float32_torch.float32": {
        "kwargs": {
            "BLOCK_J": 32,
            "BLOCK_K": 16
        },
        "num_warps": 1,
        "num_stages": 1,
        "num_ctas": 1,
        "maxnreg": null
    },
    "1_64_2048_torch.float32_torch.float32_torch.float32_torch.float32_torch.float32_torch.float32_torch.bool_torch.float32_torch.float32_torch.float32": {
        "kwargs": {
            "BLOCK_J": 32,
            "BLOCK_K": 16
        },
        "num_warps": 2,
        "num_stages": 2,
        "num_ctas": 1,
        "maxnreg": null
    },
    "4_16_2048_torch.float32_torch.float32_torch.float32_torch.float32_torch.float32_torch.float32_torch.bool_torch.float32_torch.float32_torch.float32": {
        "kwargs": {
            "BLOCK_J": 32,
            "BLOCK_K": 32
        },
        "num_warps": 1,
        "num_stages": 1,
        "num_ctas": 1,
        "maxnreg": null
    },
    "4_32_2048_torch.float32_torch.float32_torch.float32_torch.float32_torch.float32_torch.float32_torch.bool_torch.float32_torch.float32_torch.float32": {
        "kwargs": {
            "BLOCK_J": 32,
            "BLOCK_K": 16
        },
        "num_warps": 1,
        "num_stages": 1,
        "num_ctas": 1,
        "maxnreg": null
    },
    "4_16_16_torch.bfloat16_torch.bfloat16_torch.bfloat16_torch.bfloat16_torch.bfloat16_torch.float32_torch.bool_torch.bfloat16_torch.bfloat16_torch.bfloat16": {
        "kwargs": {
            "BLOCK_J": 16,
            "BLOCK_K": 16
        },
        "num_warps": 2,
        "num_stages": 1,
        "num_ctas": 1,
        "maxnreg": null
    },
    "4_32_16_torch.bfloat16_torch.bfloat16_torch.bfloat16_torch.bfloat16_torch.bfloat16_torch.float32_torch.bool_torch.bfloat16_torch.bfloat16_torch.bfloat16": {
        "kwargs": {
            "BLOCK_J": 16,
            "BLOCK_K": 16
        },
        "num_warps": 2,
        "num_stages": 1,
        "num_ctas": 1,
        "maxnreg": null
    },
    "4_16_16_torch.float32_torch.float32_torch.float32_torch.float32_torch.float32_torch.float32_torch.bool_torch.float32_torch.float32_torch.float32": {
        "kwargs": {
            "BLOCK_J": 16,
            "BLOCK_K": 16
        },
        "num_warps": 2,
        "num_stages": 1,
        "num_ctas": 1,
        "maxnreg": null
    },
    "4_32_16_torch.float32_torch.float32_torch.float32_torch.float32_torch.float32_torch.float32_torch.bool_torch.float32_torch.float32_torch.float32": {
        "kwargs": {
            "BLOCK_J": 16,
            "BLOCK_K": 16
        },
        "num_warps": 2,
        "num_stages": 1,
        "num_ctas": 1,
        "maxnreg": null
    },
    "1_16_16_torch.float32_torch.float32_torch.float32_torch.float32_torch.float32_torch.float32_torch.bool_torch.float32_torch.float32_torch.float32": {
        "kwargs": {
            "BLOCK_J": 16,
            "BLOCK_K": 16
        },
        "num_warps": 2,
        "num_stages": 1,
        "num_ctas": 1,
        "maxnreg": null
    },
    "1_16_16_torch.float16_torch.float16_torch.float16_torch.float16_torch.float16_torch.float32_torch.bool_torch.float16_torch.float16_torch.float16": {
        "kwargs": {
            "BLOCK_J": 32,
            "BLOCK_K": 16
        },
        "num_warps": 2,
        "num_stages": 3,
        "num_ctas": 1,
        "maxnreg": null
    },
    "1_16_16_torch.bfloat16_torch.bfloat16_torch.bfloat16_torch.bfloat16_torch.bfloat16_torch.float32_torch.bool_torch.bfloat16_torch.bfloat16_torch.bfloat16": {
        "kwargs": {
            "BLOCK_J": 16,
            "BLOCK_K": 16
        },
        "num_warps": 1,
        "num_stages": 2,
        "num_ctas": 1,
        "maxnreg": null
    },
    "1_32_32_torch.float16_torch.float16_torch.float16_torch.float16_torch.float16_torch.float32_torch.bool_torch.float16_torch.float16_torch.float16": {
        "kwargs": {
            "BLOCK_J": 32,
            "BLOCK_K": 16
        },
        "num_warps": 4,
        "num_stages": 3,
        "num_ctas": 1,
        "maxnreg": null
    },
    "1_64_64_torch.float16_torch.float16_torch.float16_torch.float16_torch.float16_torch.float32_torch.bool_torch.float16_torch.float16_torch.float16": {
        "kwargs": {
            "BLOCK_J": 64,
            "BLOCK_K": 32
        },
        "num_warps": 4,
        "num_stages": 1,
        "num_ctas": 1,
        "maxnreg": null
    },
    "4_32_2048_torch.bfloat16_torch.bfloat16_torch.bfloat16_torch.bfloat16_torch.bfloat16_torch.float32_torch.bool_torch.bfloat16_torch.bfloat16_torch.bfloat16": {
        "kwargs": {
            "BLOCK_J": 32,
            "BLOCK_K": 32
        },
        "num_warps": 1,
        "num_stages": 2,
        "num_ctas": 1,
        "maxnreg": null
    },
    "1_16_2048_torch.bfloat16_torch.bfloat16_torch.bfloat16_torch.bfloat16_torch.bfloat16_torch.float32_torch.bool_torch.bfloat16_torch.bfloat16_torch.bfloat16": {
        "kwargs": {
            "BLOCK_J": 16,
            "BLOCK_K": 64
        },
        "num_warps": 1,
        "num_stages": 1,
        "num_ctas": 1,
        "maxnreg": null
    }
}